{
  "id": "eds-cholent",
  "title": "Ed's Cholent",
  "description": "A slow-cooked Shabbos stew of beef cubes, brown rice and sliced potatoes made in a crock pot.",
  "category": "main",
  "tags": [
    "meat",
    "shabbos",
    "slow-cooker",
    "swaying-branches"
  ],
  "source": "https://swaying-branches.blogspot.com/2019/02/recipes.html",
  "yield": {
    "amount": 6,
    "unit": "quarts"
  },
  "timing": {
    "prep": "PT20M",
    "cook": "PT24H",
    "total": "PT24H20M"
  },
  "ingredients": [
    {
      "items": [
        {
          "quantity": 1,
          "unit": "quart",
          "item": "water",
          "scalable": true
        },
        {
          "quantity": 3,
          "unit": "heaping teaspoons",
          "item": "salt",
          "scalable": false
        },
        {
          "quantity": 1,
          "unit": "heaping teaspoon",
          "item": "garlic powder",
          "scalable": false
        },
        {
          "quantity": 1,
          "unit": "level teaspoon",
          "item": "black pepper",
          "scalable": false
        },
        {
          "quantity": 1,
          "unit": null,
          "item": "large onion",
          "notes": "diced",
          "scalable": true
        },
        {
          "quantity": 5,
          "unit": "pounds",
          "item": "potatoes",
          "notes": "peeled, sliced",
          "scalable": true
        },
        {
          "quantity": 1.5,
          "unit": "pounds",
          "item": "beef cubes",
          "scalable": true
        },
        {
          "quantity": 1.5,
          "unit": "cups",
          "item": "brown rice",
          "scalable": true
        }
      ]
    }
  ],
  "steps": [
    {
      "heading": "Preparation",
      "steps": [
        {
          "instruction": "Add 2 cups water and place liner (will prevent scorching) in crock pot."
        },
        {
          "instruction": "Combine water, salt, pepper, garlic and onion and add to 6 quart crock pot."
        },
        {
          "instruction": "Place beef first, then rice and finally potatoes. Sprinkle with garlic powder and pepper. Cover."
        }
      ]
    },
    {
      "heading": "Cooking Instructions",
      "steps": [
        {
          "instruction": "Turn crock pot on high for three hours or until bubbling occurs, then turn down to medium.",
          "duration": "PT3H"
        },
        {
          "instruction": "Cholent will be ready to eat 24 hours later.",
          "duration": "PT24H"
        },
        {
          "instruction": "Add water to brim just before Shabbos."
        }
      ]
    },
    {
      "heading": "Or",
      "steps": [
        {
          "instruction": "Use regular pot, cover and cook for 2 to 3 hours. You will have to watch pot and turn down flame to avoid scorching.",
          "duration": "PT3H"
        }
      ]
    }
  ],
  "notes": [
    "We always take some potatoes out for dinner the nite before.",
    "Prep time estimated; not stated in original. Cook time is the stated 24 hours in the crock pot.",
    "Transcription note: Yield not stated in original; recipe is sized for a 6 quart crock pot, so yield recorded as 6 quarts."
  ]
}
