{
  "id": "chicken-soup",
  "title": "Chicken Soup",
  "description": "A large-batch chicken soup with carrots, celery and onions, served with acini di pepe pasta.",
  "category": "soup",
  "tags": [
    "meat",
    "large-batch",
    "swaying-branches"
  ],
  "source": "https://swaying-branches.blogspot.com/2019/02/recipes.html",
  "sourceImages": [
    "swaying-branches/chicken-soup.jpg"
  ],
  "yield": {
    "amount": 1,
    "unit": "16-quart pot"
  },
  "timing": {
    "prep": "PT15M",
    "cook": "PT2H",
    "total": "PT2H15M"
  },
  "ingredients": [
    {
      "items": [
        {
          "quantity": 8,
          "unit": "quarts",
          "item": "chicken broth",
          "scalable": true
        },
        {
          "quantity": 0.25,
          "unit": "bag",
          "item": "diced celery",
          "notes": "1 lb",
          "scalable": true
        },
        {
          "quantity": 0.25,
          "unit": "bag",
          "item": "diced onions",
          "notes": "1 lb",
          "scalable": true
        },
        {
          "quantity": 10,
          "unit": "lbs",
          "item": "sliced carrots",
          "scalable": true
        },
        {
          "quantity": 1,
          "unit": "tsb",
          "item": "black pepper",
          "notes": "printed as \"1tsb\"",
          "scalable": false
        },
        {
          "quantity": null,
          "unit": null,
          "item": "Osem pareve chicken broth",
          "notes": "as needed",
          "scalable": false
        },
        {
          "quantity": 2,
          "unit": "lbs",
          "item": "acini di pepe",
          "scalable": true
        }
      ]
    }
  ],
  "steps": [
    {
      "heading": "Preparation",
      "steps": [
        {
          "instruction": "Mix all ingredients together(except acini di pepe) in 16 quart pot."
        }
      ]
    },
    {
      "heading": "Cooking Instructions",
      "steps": [
        {
          "instruction": "Bring soup to boil and simmer for 1 1/2 to 2 hours.",
          "duration": "PT2H"
        },
        {
          "instruction": "Boil water for acini di pepe. Take off heat, add acini di pepe, stir, cover and let sit for 15 to 20 minutes",
          "duration": "PT20M"
        }
      ]
    }
  ],
  "notes": [
    "For making 2 pots of chicken soup, halve the quantities of diced onions, diced celery, carrots and chicken broth for each 20 quart pot and fill to top with water. Add Osem Chicken Broth approximately 1/2 to 3/4 14.1 oz container to taste.",
    "Transcription note: Black pepper unit is printed as \"1tsb\", which is ambiguous between teaspoon and tablespoon; kept as printed.",
    "Transcription note: Yield not stated in original; recorded as one 16-quart pot (the pot size named in the preparation step).",
    "Timing estimated; not stated in original.",
    "Cook time uses the upper end of the stated 1 1/2 to 2 hour simmer.",
    "Transcription note: The acini di pepe step duration records the upper end of the stated 15 to 20 minutes."
  ]
}
